{
 "step_id": "S17",
 "band": "L6",
 "packet_sha256": "sha256:fbdc9e356bb6ae556d72c7813dc01ce8416166713dd904c5c5f55a732de457b4",
 "author": {
  "host": "Claude Code desktop, in-session",
  "model": "claude-opus-5-5"
 },
 "attempt": 1,
 "frame_parts": {
  "impact": [
   2.5,
   4.7,
   5.5,
   6.6,
   8.5,
   9.0
  ],
  "smear": [
   {
    "t0": 0.3,
    "t1": 0.6,
    "subject": "ninja_lean",
    "part": "right_leg",
    "note": "A fall only,the tucked legs lead"
   },
   {
    "t0": 1.1,
    "t1": 1.6,
    "subject": "ninja_lean",
    "part": "right_leg",
    "note": "A sprint down pillar only"
   },
   {
    "t0": 2.0,
    "t1": 2.5,
    "subject": "kunai",
    "part": null,
    "note": "kunai path only"
   },
   {
    "t0": 4.7,
    "t1": 5.1,
    "subject": "ninja_lean",
    "part": "left_leg",
    "note": "A aerial backflip left leg crescent arc only,body does NOT smear"
   },
   {
    "t0": 5.5,
    "t1": 5.9,
    "subject": "shuriken_volley",
    "part": null,
    "note": "THREE shuriken arc only"
   },
   {
    "t0": 6.3,
    "t1": 6.6,
    "subject": "ninja_lean",
    "part": "left_arm",
    "note": "A cartwheel-to-elbow arc only,left elbow leads"
   },
   {
    "t0": 7.5,
    "t1": 8.5,
    "subject": "rope_dart",
    "part": null,
    "note": "rope dart line and A descent path only"
   }
  ],
  "speedlines": [
   {
    "t0": 0.0,
    "t1": 0.6,
    "subject": "ninja_lean"
   },
   {
    "t0": 1.1,
    "t1": 1.6,
    "subject": "ninja_lean"
   },
   {
    "t0": 2.0,
    "t1": 2.5,
    "subject": "kunai"
   },
   {
    "t0": 4.7,
    "t1": 5.1,
    "subject": "ninja_lean"
   },
   {
    "t0": 5.5,
    "t1": 5.9,
    "subject": "shuriken_volley"
   },
   {
    "t0": 6.3,
    "t1": 6.6,
    "subject": "ninja_lean"
   },
   {
    "t0": 7.5,
    "t1": 8.5,
    "subject": "rope_dart"
   }
  ],
  "holds": [
   {
    "t": 0.6,
    "frames": 3
   },
   {
    "t": 1.6,
    "frames": 2
   },
   {
    "t": 2.5,
    "frames": 3
   },
   {
    "t": 3.7,
    "frames": 3
   },
   {
    "t": 4.4,
    "frames": 2
   },
   {
    "t": 4.7,
    "frames": 3
   },
   {
    "t": 5.9,
    "frames": 3
   },
   {
    "t": 6.6,
    "frames": 3
   },
   {
    "t": 7.0,
    "frames": 2
   },
   {
    "t": 8.5,
    "frames": 4
   }
  ],
  "fx": [
   {
    "t": 0.6,
    "t_end": null,
    "text": "pillar-top landing dust burst"
   },
   {
    "t": 2.5,
    "t_end": null,
    "text": "foot-deflect spark at kunai"
   },
   {
    "t": 3.7,
    "t_end": null,
    "text": "smoke burst expanding"
   },
   {
    "t": 4.0,
    "t_end": null,
    "text": "log impact spark"
   },
   {
    "t": 4.7,
    "t_end": null,
    "text": "knee-impact flash at B spine"
   },
   {
    "t": 5.1,
    "t_end": null,
    "text": "backflip trail"
   },
   {
    "t": 5.5,
    "t_end": null,
    "text": "shuriken throw flash"
   },
   {
    "t": 6.6,
    "t_end": null,
    "text": "throw release flash"
   },
   {
    "t": 7.0,
    "t_end": null,
    "text": "pillar push dust"
   },
   {
    "t": 7.5,
    "t_end": null,
    "text": "rope dart anchor wrap"
   },
   {
    "t": 8.0,
    "t_end": null,
    "text": "rope dart pull tension line"
   },
   {
    "t": 8.5,
    "t_end": null,
    "text": "kunai drive impact flash"
   },
   {
    "t": 9.0,
    "t_end": null,
    "text": "crash dust burst"
   },
   {
    "t": 9.5,
    "t_end": 10.0,
    "text": "embers and moon rim"
   }
  ],
  "ink": "heavy on A,broken in smears,clean on holds,smear follows ONLY the declared limb or prop,body does NOT smear"
 }
}
